[
  { "id": "f1", "statement": "Deep fascia (including the thoracolumbar fascia) is richly innervated with free nerve endings and nociceptors, and is often more pain-sensitive than the underlying muscle — establishing fascia as a genuine, primary source of nociception rather than an inert wrapping.", "answers": ["mechanism"], "cites": ["s1", "s2", "s19", "s8"], "verification": "corroborated", "confidence": "high" },
  { "id": "f2", "statement": "Fascial 'densification' — increased viscosity and packing of hyaluronan in the loose connective tissue between fascial layers — reduces the normal gliding of adjacent layers and is proposed to stimulate embedded nociceptors, forming a mechanical basis for myofascial pain.", "answers": ["mechanism"], "cites": ["s5", "s15", "s2"], "verification": "corroborated", "confidence": "medium" },
  { "id": "f3", "statement": "Fascia is mechanotransductive: mechanical strain drives fibroblast signaling (e.g. IL-6 secretion and a proposed Ca2+-hyaluronan feedback axis via Piezo1/TRPV4), coupling mechanical load to inflammation and matrix remodeling.", "answers": ["mechanism"], "cites": ["s5", "s9", "s1"], "verification": "corroborated", "confidence": "medium" },
  { "id": "f4", "statement": "Fibrosis, thickening, and neuroinflammation in pathological fascia sensitize local nerve fibers and are hypothesized to feed central sensitization, linking peripheral fascial change to chronic, widespread pain.", "answers": ["mechanism"], "cites": ["s1", "s3", "s8"], "verification": "corroborated", "confidence": "medium" },
  { "id": "f5", "statement": "Chronic low back pain is associated with a thicker thoracolumbar fascia and reduced shear strain / gliding versus healthy controls — one of the most reproducible objective fascial correlates of a chronic pain condition.", "answers": ["conditions", "measurement"], "cites": ["s6", "s7", "s16"], "verification": "corroborated", "confidence": "high" },
  { "id": "f6", "statement": "Fibromyalgia has been hypothesized to involve fascial inflammation and dysfunction (elevated inflammatory/oxidative markers and increased collagen in intramuscular connective tissue), but this remains a contested, evolving hypothesis rather than established pathology.", "answers": ["conditions"], "cites": ["s8", "s9", "s10"], "verification": "corroborated", "confidence": "low" },
  { "id": "f7", "statement": "Myofascial pain syndrome is increasingly framed as a disorder of the fascia (densification, altered innervation), and some authors propose it can progress toward fibromyalgia through connective-tissue changes ('fascial armoring') — a mechanistically plausible but speculative link.", "answers": ["conditions", "mechanism"], "cites": ["s1", "s9", "s10"], "verification": "corroborated", "confidence": "low" },
  { "id": "f8", "statement": "Other regional conditions implicate fascial pathology directly, including plantar fasciitis (plantar fascia thickening/degeneration) and complex regional pain syndrome (fascial fibrosis from persistent fibroblast activation).", "answers": ["conditions"], "cites": ["s3", "s13", "s14"], "verification": "corroborated", "confidence": "medium" },
  { "id": "f9", "statement": "Myofascial release improves pain and physical function in chronic low back pain in meta-analysis, but shows no clear benefit for quality of life, pressure-pain threshold, or trunk mobility, and the overall evidence quality is low.", "answers": ["treatments"], "cites": ["s11", "s12"], "verification": "corroborated", "confidence": "medium" },
  { "id": "f10", "statement": "The mechanistic rationale for manual fascial therapies (e.g. Stecco Fascial Manipulation) is that deep friction raises tissue temperature and fragments densified hyaluronan, restoring gliding — a plausible mechanism supported by tissue studies, though distinct from proof of clinical efficacy.", "answers": ["treatments", "mechanism"], "cites": ["s5", "s15"], "verification": "corroborated", "confidence": "medium" },
  { "id": "f11", "statement": "Evidence for extracorporeal shockwave therapy in chronic recalcitrant plantar fasciitis is mixed: individual placebo-controlled RCTs conflict, but meta-analysis favors low-intensity ESWT over control for pain relief, and the treatment is generally considered safe.", "answers": ["treatments"], "cites": ["s13", "s14", "s4"], "verification": "corroborated", "confidence": "medium" },
  { "id": "f12", "statement": "Across fascia-targeting treatments, the recurring conclusion is that they show promise but rest on a small, heterogeneous, low-quality evidence base — more rigorous, adequately powered RCTs are needed before firm efficacy claims are warranted.", "answers": ["treatments", "directions"], "cites": ["s11", "s12", "s14"], "verification": "corroborated", "confidence": "high" },
  { "id": "f13", "statement": "Ultrasound can objectively quantify fascial thickness and, via cine cross-correlation, shear strain; chronic low back pain patients show markedly reduced thoracolumbar fascia shear strain, providing an imaging correlate of impaired gliding.", "answers": ["measurement"], "cites": ["s6", "s7"], "verification": "corroborated", "confidence": "high" },
  { "id": "f14", "statement": "Shear-wave elastography reliably measures stiffness across skin, fascia, and muscle layers, and thoracolumbar fascia stiffness correlates with disability (Oswestry Disability Index) in chronic non-specific low back pain.", "answers": ["measurement"], "cites": ["s16", "s17"], "verification": "corroborated", "confidence": "medium" },
  { "id": "f15", "statement": "The objective fascial-imaging measures remain cross-sectional associations with pain, not demonstrated causes, and are not yet standardized clinical tools — a key limitation of the current measurement evidence.", "answers": ["measurement", "directions"], "cites": ["s7", "s16"], "verification": "corroborated", "confidence": "medium" },
  { "id": "f16", "statement": "Fascia's definition and nomenclature remain unsettled (the Fascia Research Society consensus was updated in 2024, with ongoing debate over whether perimysium and endomysium count as fascia), which complicates comparison across studies and has historically slowed pain research.", "answers": ["directions"], "cites": ["s18"], "verification": "single-source", "confidence": "high" },
  { "id": "f17", "statement": "The central open questions are causation versus correlation between fascial change and pain, standardization of measurement, and whether fascia-targeted treatments actually work through fascial mechanisms; authors consistently characterize current evidence as preliminary and heterogeneous.", "answers": ["directions"], "cites": ["s1", "s19", "s20"], "verification": "corroborated", "confidence": "medium" }
]
